{
  "approval_ref": null,
  "artifacts": [
    {
      "digest": "sha256:86e5f51961b2f0aba3a4a76003e628f559ac8a53176be729a65ff6288079fefe",
      "kind": "policy-report",
      "redaction": "credentials-stripped"
    }
  ],
  "budget": {
    "reserved": {
      "max_output_bytes": 1048576,
      "max_spend": null,
      "max_tool_steps": 1,
      "timeout_ms": 30000
    },
    "spent": {
      "elapsed_ms": 10000,
      "output_bytes": 165,
      "spend": 0,
      "tool_steps": 1
    }
  },
  "capability_id": "metasploit-mcp.list_listeners",
  "cleanup": {
    "proof_digest": null,
    "required": false,
    "residual": false
  },
  "coverage": {
    "attempted": [
      "metasploit-mcp.list_listeners"
    ],
    "complete": [
      "metasploit-mcp.list_listeners"
    ],
    "failed": [],
    "required": [
      "metasploit-mcp.list_listeners"
    ],
    "skipped": [],
    "unsupported": []
  },
  "finished_at": "2026-09-06T17:34:35Z",
  "limitations": [],
  "roe_ref": null,
  "safety_class": "R0",
  "schema": "specaudit.ctf.execution-result.v1",
  "schema_version": 1,
  "scope": {
    "authorized": [
      "policy://extension/arms/metasploit-mcp"
    ],
    "touched": [
      "policy://extension/arms/metasploit-mcp"
    ]
  },
  "side_effects": [
    "local-read"
  ],
  "started_at": "2026-09-06T17:34:25Z",
  "status": "complete",
  "tool": {
    "name": "specaudit-ctf",
    "version": "0.1.0"
  },
  "transport_ok": true
}
