{
  "schema": "specaudit.ctf.execution-result.v1",
  "schema_version": 1,
  "capability_id": "fixture.range-observe",
  "tool": {
    "name": "fixture-range",
    "version": "1.0.0"
  },
  "scope": {
    "authorized": [
      "file:///extension/range/tf_s3_public_access",
      "file:///extension/range/tf_iam_open"
    ],
    "touched": ["file:///extension/range/tf_s3_public_access"]
  },
  "safety_class": "R0",
  "side_effects": ["local-read"],
  "approval_ref": null,
  "roe_ref": "roe:synthetic-range",
  "budget": {
    "reserved": {
      "timeout_ms": 60000,
      "max_output_bytes": 1048576,
      "max_tool_steps": 16,
      "max_spend": null
    },
    "spent": {
      "elapsed_ms": 2200,
      "output_bytes": 512,
      "tool_steps": 2,
      "spend": 0
    }
  },
  "started_at": "2026-08-25T12:00:00Z",
  "finished_at": "2026-08-25T12:00:02Z",
  "status": "degraded",
  "transport_ok": true,
  "artifacts": [
    {
      "digest": "sha256:284a00d36f3b0def21f51a297cec3c1f7c33b0151a325e1435f23e6e621f6899",
      "kind": "range-report",
      "redaction": "credentials-stripped"
    }
  ],
  "coverage": {
    "attempted": ["fixture.local-read", "fixture.optional-probe"],
    "complete": ["fixture.local-read"],
    "skipped": ["fixture.optional-probe"],
    "unsupported": [],
    "failed": [],
    "required": ["fixture.local-read"]
  },
  "cleanup": {
    "required": false,
    "proof_digest": null,
    "residual": false
  },
  "limitations": ["optional arm fixture.optional-probe is not installed"]
}
