{
  "approval_ref": null,
  "artifacts": [
    {
      "digest": "sha256:9f602173f698b1abc432396e396eeca52a004b7cffede63d3ba80f04448c7276",
      "kind": "policy-report",
      "redaction": "credentials-stripped"
    }
  ],
  "attempt_id": "attempt-7fc0962e1a9f33a1249ff455d5e926e0a0f7fd7d5f6e0ba599b3c9fd20b94dee",
  "budget": {
    "reserved": {
      "max_output_bytes": 1048576,
      "max_spend": null,
      "max_tool_steps": 1,
      "timeout_ms": 30000
    },
    "spent": {
      "elapsed_ms": 10000,
      "output_bytes": 3844,
      "spend": 0,
      "tool_steps": 1
    }
  },
  "capability_id": "metasploit-mcp.list_exploits",
  "cleanup": {
    "proof_digest": null,
    "required": false,
    "residual": false
  },
  "coverage": {
    "attempted": [
      "metasploit-mcp.list_exploits"
    ],
    "complete": [
      "metasploit-mcp.list_exploits"
    ],
    "failed": [],
    "required": [
      "metasploit-mcp.list_exploits"
    ],
    "skipped": [],
    "unsupported": []
  },
  "finished_at": "2026-09-06T17:34:45Z",
  "limitations": [],
  "roe_ref": null,
  "safety_class": "R0",
  "schema": "specaudit.ctf.execution-result.v1",
  "schema_version": 1,
  "scope": {
    "authorized": [
      "policy://extension/arms/metasploit-mcp"
    ],
    "touched": [
      "policy://extension/arms/metasploit-mcp"
    ]
  },
  "side_effects": [
    "local-read"
  ],
  "started_at": "2026-09-06T17:34:35Z",
  "status": "complete",
  "tool": {
    "name": "specaudit-ctf",
    "version": "0.1.0"
  },
  "transport_ok": true
}
